{
  "schema_version": "1.0.0",
  "id": "profile-ai-sme-generous",
  "name": "generous",
  "version": "1.0.0",
  "methodology_bundle_hash": "sha256:b252b8733d4c0ebdc89c674aef29624fe04ec29fec0273c79d4a3edf89048feb",
  "parameters": {
    "counteraction_precedence": true,
    "general_non_sme_ai_measures": "strong"
  },
  "decisions": [
    {
      "id": "decision-general-non-sme-ai-measures",
      "question": "How should general, non-SME-targeted AI legislation and national AI strategy documents be classified under the rubric?",
      "choice": {
        "classification": "strong",
        "instruments": [
          "jp-ai-act",
          "jp-first-basic-ai-plan",
          "us-americas-ai-action-plan",
          "us-genesis-mission",
          "us-national-policy-framework-ai"
        ]
      },
      "alternatives_considered": [
        {
          "classification": "weak",
          "instruments": [
            "jp-ai-act",
            "jp-first-basic-ai-plan",
            "us-americas-ai-action-plan",
            "us-genesis-mission",
            "us-national-policy-framework-ai"
          ]
        },
        {
          "classification": "strong",
          "instruments": [
            "jp-ai-act",
            "jp-first-basic-ai-plan",
            "us-americas-ai-action-plan",
            "us-genesis-mission",
            "us-national-policy-framework-ai"
          ]
        }
      ],
      "rationale": "The same general AI legislation and national strategy documents are read as STRONG, on the view that economy-wide AI frameworks materially advance SME AI adoption (legislation facilitating integration). Under this reading Japan reaches five strong actions and flips to +1, demonstrating the interpretation-sensitivity of the published scores.",
      "source_passage_ids": [
        "passage-scoring-guidelines",
        "passage-definition-strong",
        "passage-definition-weak",
        "passage-japan-ai-act",
        "passage-japan-first-basic-ai-plan",
        "passage-united_states-americas-ai-action-plan",
        "passage-united_states-genesis-mission",
        "passage-united_states-national-policy-framework-ai"
      ],
      "status": "accepted",
      "approved_by": ["mehek-berry", "isabella-chan-combrink"],
      "approved_at": "2026-06-12T00:00:00Z"
    }
  ],
  "waivers": [],
  "status": "approved",
  "created_at": "2026-06-01T00:00:00Z",
  "created_by": "g7-research-group",
  "canonical_hash": "sha256:5562e7ea248e426bda00663067fe17df63229e07d2290f9ca1dcaedc05e0511c"
}
