{
  "schema_version": "1.0.0",
  "id": "profile-ai-sme-resolved-default",
  "name": "resolved-default",
  "version": "1.0.0",
  "methodology_bundle_hash": "sha256:0000000000000000000000000000000000000000000000000000000000000000",
  "parameters": {
    "counteraction_precedence": true,
    "many_weak_actions_result": "0"
  },
  "decisions": [
    {
      "id": "decision-counter-precedence",
      "question": "Does a qualifying counteraction override positive action counts?",
      "choice": "yes",
      "alternatives_considered": [
        "no",
        "netting"
      ],
      "rationale": "This profile makes precedence explicit so the score program is deterministic.",
      "status": "accepted",
      "approved_by": [
        "methodologist-example"
      ],
      "approved_at": "2026-07-22T15:00:00Z"
    },
    {
      "id": "decision-many-weak",
      "question": "How is “up to four strong actions” operationalized, and how are zero-strong cases with five or more weak actions scored?",
      "choice": "0",
      "alternatives_considered": [
        "-1",
        "unresolved"
      ],
      "rationale": "This profile interprets the phrase as requiring at least one strong action for that branch, then separately assigns three or more weak actions to partial compliance. The choice is explicit because an inclusive zero-to-four reading creates a different overlap.",
      "status": "accepted",
      "approved_by": [
        "methodologist-example"
      ],
      "approved_at": "2026-07-22T15:00:00Z"
    }
  ],
  "waivers": [],
  "status": "approved",
  "created_at": "2026-07-22T14:00:00Z",
  "created_by": "methodologist-example",
  "canonical_hash": "sha256:1111111111111111111111111111111111111111111111111111111111111111"
}
