{
  "schema_version": "1.0.0",
  "id": "profile-ai-sme-published",
  "name": "published",
  "version": "1.0.0",
  "methodology_bundle_hash": "sha256:b252b8733d4c0ebdc89c674aef29624fe04ec29fec0273c79d4a3edf89048feb",
  "parameters": {
    "counteraction_precedence": true,
    "general_non_sme_ai_measures": "weak"
  },
  "decisions": [
    {
      "id": "decision-general-non-sme-ai-measures",
      "question": "How should general, non-SME-targeted AI legislation and national AI strategy documents be classified under the rubric?",
      "choice": {
        "classification": "weak",
        "instruments": [
          "jp-ai-act",
          "jp-first-basic-ai-plan",
          "us-americas-ai-action-plan",
          "us-genesis-mission",
          "us-national-policy-framework-ai"
        ]
      },
      "alternatives_considered": [
        {
          "classification": "weak",
          "instruments": [
            "jp-ai-act",
            "jp-first-basic-ai-plan",
            "us-americas-ai-action-plan",
            "us-genesis-mission",
            "us-national-policy-framework-ai"
          ]
        },
        {
          "classification": "strong",
          "instruments": [
            "jp-ai-act",
            "jp-first-basic-ai-plan",
            "us-americas-ai-action-plan",
            "us-genesis-mission",
            "us-national-policy-framework-ai"
          ]
        }
      ],
      "rationale": "General AI legislation and national strategy documents that are not tailored to SMEs are scored WEAK, per the rubric's exclusion of 'general AI programs not tailored to SMEs' and the report's own 'recommendation phase / indirect' language. This reproduces the published Japan and United States cells.",
      "source_passage_ids": [
        "passage-scoring-guidelines",
        "passage-definition-strong",
        "passage-definition-weak",
        "passage-japan-ai-act",
        "passage-japan-first-basic-ai-plan",
        "passage-united_states-americas-ai-action-plan",
        "passage-united_states-genesis-mission",
        "passage-united_states-national-policy-framework-ai"
      ],
      "status": "accepted",
      "approved_by": ["mehek-berry", "isabella-chan-combrink"],
      "approved_at": "2026-06-12T00:00:00Z"
    }
  ],
  "waivers": [],
  "status": "approved",
  "created_at": "2026-06-01T00:00:00Z",
  "created_by": "g7-research-group",
  "canonical_hash": "sha256:a4be25d9239cbf91c50b16fa024bbbc2a5bd2f30efab23a6f9469d10f1ee7198"
}
